video_id,num_option,qid,a0,a1,a2,a3,a4,answer,question,type
4485707628,5,6,shake its body.,run away.,retreat.,supporting.,lie down.,lie down.,what does the white dog do on the rock after it has jumped up?,TN
5875242364,5,3,move back to spot to jump.,put his fingers in his mouth.,jump out.,go to lady.,comes out.,jump out.,what did the dog do after it finished kicking the water in the pool?,TN
8253302563,5,6,press the horn with his hand.,moves to the side.,moving ti around.,eat again.,hold and move baby s arms.,press the horn with his hand.,what does the boy do after chewing the horn at the end?,TN
4671452046,5,10,pointed at baby.,look down.,stands up.,laughs.,wipes her eyes.,laughs.,what did the lady in brown do after talking to the lady in purple?,TN
11670386946,5,6,talk and look at paper.,stroking the dog.,smoke.,put arms behind back.,bend also.,talk and look at paper.,what does the man in brown do after turning his head to the right at the end?,TN
3375218204,5,11,start running.,walk back into room.,picks up the grey toy.,look at boy.,talks to the lady.,walk back into room.,what do these people do after walking into a corner at the end?,TN
3164519967,5,6,adjust the baby s shirt.,wipe her hands with tissue.,smile and laugh.,sits down.,put it back.,put it back.,what did the old lady do after the baby spit out the pacifier?,TN
2584172238,5,4,point.,look at water.,slide down.,pull the white dog.,carry boy up.,carry boy up.,what did the woman in yellow do after the boy in blue slid down the slide at the middle of the video?,TN
5256928210,5,3,pet the dog.,lie on tiger.,move his hands around.,hand gestures.,smoke.,pet the dog.,what does the man do after looking at his hand near the end?,TN
5521781780,5,4,turns around.,change slides.,stands on the corner.,catch the ball.,put hand in mouth.,stands on the corner.,what does the man in black cap do after reaching the border of the structure near the end?,TN
2400171624,5,7,sat down.,moves hands.,change direction.,shake body vigorously.,jump.,change direction.,what does the skier do after stopping for a while?,TN
8388104887,5,3,bat.,hit with racket.,throw the ball.,lie down.,walk back.,walk back.,what did the dog do after it picked up the ball that was thrown?,TN
5145526755,5,8,lift its head up.,rest.,lick mouth.,charges forward.,look to the side.,look to the side.,what does the lioness on the left do after staring forward for a while at the start?,TN
7691172922,5,6,guide dog while running.,turn around and wait for lady.,go to the back of cage.,lie on the ground.,run around the man.,turn around and wait for lady.,what does the dog do after running up the stairs?,TN
5679866364,5,4,hold the girl s stomach.,look at boy.,move her hands away from her thighs.,touch the baby s arm.,jump into water.,move her hands away from her thighs.,what did the last lady in the bikini do with her hands after she enters the water?,TN
7786283208,5,8,playing the guitar.,walks away.,take food.,watching television.,walks forward.,walks away.,what does the boy do after getting up?,TN
4822859674,5,7,carry the baby down.,crawl.,got back up.,stand up and dance.,pick it up.,crawl.,what did the boy who fell on the floor at the beginning of the video do after he fell?,TN
8224492254,5,9,open his palm.,put his hand into mouth.,pick up the bottle.,closes his finger.,touch his hand.,closes his finger.,what did the adult do after the baby bite on his finger?,TN
5406108447,5,6,lift it up.,suck his thumb.,blur.,crawl back up the pillow.,put his fingers in his mouth.,lift it up.,what did the baby do after hitting the floor with the towel?,TN
7114553643,5,4,touch his head.,put the box aside.,hugs her.,tilt head forward.,dances.,dances.,what did the lady do after the man hugged her in the middle of the video?,TN
8990144134,5,6,lick the other cat.,no reaction.,keep watching the string move.,rubs against him.,look at bird.,look at bird.,what does the cat do after hitting the bird?,TN
4485498145,5,6,lean against the screen.,lost balance.,turn to his right.,clap.,look down and shake head.,turn to his right.,what does the half bald man do after nodding at the end?,TN
6300775954,5,8,sit down.,check documents.,take a few steps back.,hold a cross sign.,showed it to the camera.,take a few steps back.,what did the lady do after she took the dumbbell from the rack?,TN
7786283208,5,4,grab her.,cup.,run towards the camera.,play with leash.,go to lady in stripes.,run towards the camera.,what did the girl in white do after getting up?,TN
4217422838,5,8,pulled the jeans down.,pick the toy from water.,look at baby.,fall onto the ground.,stand up.,stand up.,what did the boy do after he completely tore the wrappers from the spear?,TN
5205081904,5,7,walk forward.,pick up grass.,bend down and touch the woman s back.,lie backwards.,continue cycling.,lie backwards.,what did the boy do after squatting down for a while?,TN
3249402410,5,8,slice the pizza.,cut the meat.,point.,put cheese.,put on plate.,put cheese.,what did the lady in black on the left do after she finished spreading the sauce on her pizza?,TN
9612838272,5,6,slide down.,grab the camera.,wave and dance.,playing with toys.,climb onto man s back.,slide down.,what does the girl do after climbing up?,TN
5858985747,5,6,sofa.,turn around.,pick up phone.,bend down.,excited.,pick up phone.,what does the baby in yellow do after walking close to the sofa at the end?,TN
4707679105,5,10,stand behind baby.,lift bottle to drink.,moved the car on the table.,gets back up.,look at the man.,look at the man.,what did the boy do after he pointed at the book at the end of the video?,TN
7888256388,5,3,looks at the direction.,put dog back.,walk away.,move backwards.,eat food.,walk away.,what did the dog do after sniffing the lady s shoes?,TN
6727904179,5,6,walk away.,reach for the airconditioners.,walk to baby.,very happy.,grab the back of his chair.,walk away.,what did the boy do after he reached the end of the window?,TN
8604794910,5,0,pose with racquet.,prepares swinging again.,hi-five.,walk to white basket.,looking at arcade.,pose with racquet.,what did the children do each time after they swing the racquet?,TN
10082798964,5,7,scrunch her fingers.,rubs her mouth.,drag it towards her.,walk off.,touch baby s hand.,scrunch her fingers.,what does the mother do next after raising her right hand?,TN
4083875373,5,3,tie her hair.,dancing backward.,gets dizzy.,dancing.,raise her leg.,gets dizzy.,what happens to the girl after spinning too many rounds in the middle?,TN
2782658657,5,5,picks up the water bottle.,happy.,stop.,pose for camera.,look at camera.,stop.,what did the girl in pink do after she reached the stairs?,TN
4127497265,5,7,move his head around.,shakes her head.,chew the toy.,stop crying.,close his eyes.,chew the toy.,what did the baby doing after shaking his arms?,TN
5421648216,5,4,walking.,walk away.,nothing.,move away.,chased it.,nothing.,what does the white sheep do after looking at the other two sheeps at the start?,TN
7887764754,5,2,move spoon slowly towards baby.,look at camera.,get dog to do tricks.,ignore baby.,happy.,look at camera.,what does the baby do after the dog eats the food on her hand at the start?,TN
5940941487,5,4,wave.,start clapping.,point somewhere.,smiles.,talks to him.,smiles.,what does the lady do after looking at the girl near the end of the video?,TN
3355698421,5,6,good.,flip cup for game.,picks up the glass of beer.,caps the bottle.,talk with the woman in black.,talk with the woman in black.,what does the man in checkered do after drinking from his glass?,TN
8388104887,5,2,lays down.,smell it.,looking at ball.,chase after ball.,bring it to lady in jeans.,chase after ball.,what did the dog do after the person threw the ball?,TN
6168716346,5,7,move to the side.,following him.,touch his chin.,push the blue book down.,point towards kitchen.,touch his chin.,what does the boy with blue shirt do after looking away for a while at the start?,TN
7453733046,5,3,step on water hole.,she smiled.,walked away.,wash hands in mud.,change position of her legs.,step on water hole.,what did the girl in blue do after pulling the girl in pink away?,TN
7533369046,5,2,put the box aside.,look at the white box.,carry baby up.,do a peace sign.,dance with hands.,look at the white box.,what did the baby do after she turned away from the black box at the end of the video?,TN
3943634344,5,3,look at camera.,look at the other girl.,claps.,flip page.,hands it to the baby.,claps.,what did the lady do after the girl finished reciting the pictures on the book?,TN
3046900922,5,7,pat the chair.,walked away.,jumping near the adult s knee.,rise right arm.,lie on the ground.,walked away.,what does the child do after being placed on the ground?,TN
5533380417,5,3,looks at the baby.,guide boy to lift handle.,stand there.,pinch baby s nose.,drag trolley.,looks at the baby.,what did the man do after the baby moved its hands?,TN
5561024834,5,7,gets down from the bed.,takes support.,pick up the other side.,sit prone on bed.,walk towards the girl.,gets down from the bed.,what does the boy do after doing a spin on the bed?,TN
6168716346,5,9,go to the lady.,looked at the boy in red.,sits next to the grey lady.,looked at the crayons.,flip open to read.,looked at the boy in red.,what does the boy with blue shirt do after looking at the box of crayons for a while at the end?,TN
4688219212,5,8,move back to spot to jump.,turn around.,shake his hand.,throw mickey.,climb up the stairs.,shake his hand.,what does the coach do after the boy jumps down from the rings at the end?,TN
14012319794,5,5,put down her club.,stand up.,stomp her foot.,walks away.,run around the room.,run around the room.,what did the girl do after she got the flag?,TN
4146348376,5,3,walk back to table.,talks to the lady.,joins the audience.,start writing.,smile.,start writing.,what does the man do after finishing talking to the group?,TN
8313365386,5,1,stand at the same spot.,speaks to the camera.,look at the paper.,play with it.,points her finger on something.,points her finger on something.,what does the girl in green do after she flipped the page?,TN
2584172238,5,3,happy.,come closer to the baby.,walk away.,slippery.,slide down.,slide down.,what did the girl in pink do after the boy in blue slid down the slide?,TN
4707679105,5,4,point at the book.,picks it up.,put her fingers together.,hold her up.,walk back to bed.,point at the book.,what did the baby do after the man flipped the book?,TN
4970148391,5,5,burst.,pick up and push boys away.,pass it around.,straighten up.,turn back.,burst.,what happens to the water ball after being hit?,TN
3471421544,5,1,frown.,curious.,look at lights.,dances.,try to turn around.,look at lights.,what does the baby do after he lights up the toy?,TN
10042935613,5,5,keep chewing food.,run to the plant.,rub leg.,spray at boy in brown.,walk away.,keep chewing food.,what does the boy in red do after he wiped his hands with the tissue?,TN
2454242177,5,3,resting.,starts biting the ball.,walk around in circles.,bark.,lie on the ball.,starts biting the ball.,what did the dog do after getting the ball at the start of the video?,TN
2495861393,5,8,bend down to take other things.,took bacon.,pick up toy leg.,on the bed.,caress the rabbit.,bend down to take other things.,what does the adult do after showing the children the carrot?,TN
6291413193,5,7,picks up her bottle.,licks girl.,point towards the board.,look at dolphin.,point at statue.,look at dolphin.,what did the lady do after speaking into walkie talkie?,TN
4273039295,5,11,lift her feet.,baby touch her hand.,pull him up.,stand at the same spot.,on her head.,pull him up.,what does the woman in green beanie do after the child falls down?,TN
11565498775,5,0,lean in to watch.,puts it on the table.,follow boy.,use towel cover it.,sitting on the sofa.,follow boy.,what did the man do after the boy ran away?,TN
3155382178,5,10,kick some more.,prepares swinging again.,throw ball.,run towards the ball.,shift the wooden thing.,run towards the ball.,what does the man do after kicking the ball?,TN
4219909195,5,12,clasp her hands.,kick.,bend her body.,look to his left.,touch her face.,look to his left.,what did the man do after he adjusted the girl s leg?,TN
4955723618,5,1,pass microphone to man in black.,laugh.,moves hands.,walk back to table.,talks to the lady.,pass microphone to man in black.,what did the man in grey do after he finished his speech?,TN
8253302563,5,7,running.,stood up.,adjust it.,playing with sofa.,close the door of toy car.,close the door of toy car.,what does the boy do after playing with the steering wheel for a while at the end?,TN
4857781123,5,6,get back up.,continue walking.,play with toy.,turn away.,walked to a bozx before turning back.,turn away.,what does the dog do after the toy is put away at the end?,TN
2669452260,5,4,touch his fingers.,cap the bottle.,close the bottle.,put down the can.,put on gloves.,put down the can.,what does the man do after drinking?,TN
8455160795,5,0,smile.,lift and hold by the side.,run up shore.,look at direction of ball.,behind.,run up shore.,what does the person with the stick do after pointing forward with the stick in the middle?,TN
3375218204,5,9,suck their thumb.,touches the plant.,wave their hands.,pet the dog.,stand up.,stand up.,what do the children do after lying on the ground for a while in the middle?,TN
3218498932,5,4,flash.,move backwards.,put in his mouth.,rub leg.,grab his shoulders.,rub leg.,what does the boy in red do after the boy in black touches him at the start?,TN
4688219212,5,4,smiles.,put hand inside the toy.,sit on chair.,pushes the box.,watch the boy.,watch the boy.,what does the coach do after pushing the boy up at the start?,TN
4251505427,5,6,go closer to camera.,touch white object.,put chin on table.,hit the toy.,takes them out.,go closer to camera.,what does the child with beanie do after pointing 1 finger up at the start?,TN
5061117640,5,4,sitting.,look at the presenters.,enter the room.,pick something up.,watch.,enter the room.,what does the man in grey do after looking into the room at the start?,TN
6621511673,5,6,look towards the camera.,lean forward.,smile and move hands.,swing the cradle higher.,point at another magnet.,point at another magnet.,what does the baby do after folding her hands in the middle of the video?,TN
11566930393,5,5,put hand inside the toy.,get off the dest.,sit down.,comes back.,blow to the people sitting around him.,sit down.,what does the boy do after walking around the toy at the end?,TN
2877270840,5,6,roll up sleeves.,smile.,swirl the drink.,touch his fingers.,shorten the rope.,swirl the drink.,what does the man do after drinking from the glass?,TN
7887764754,5,5,about to go out.,lie down.,run away.,sniff the babys head.,walked away.,lie down.,what does the dog do after sitting for a while in the middle?,TN
8208035645,5,0,cycle towards the slope.,bend his back.,singing.,continue reading.,riding bicycle.,cycle towards the slope.,what does the boy do after making a turn?,TN
7987845241,5,5,running.,bends down to pat dog.,put its paw back.,wag tail.,play with dog.,put its paw back.,what does the dog do after the injection is done?,TN
4083875373,5,4,smile at camera.,take the music script.,nod head and stares.,put down her club.,rolls on the ground.,rolls on the ground.,what does the girl do after sitting down near the end?,TN
2623954636,5,9,try to take it back.,drink from the lid.,turn around.,picks it up.,walk backwards while watching bowl move.,try to take it back.,what did the boy do after the ball rolled under the chair?,TN
3218498932,5,5,touch boy in red.,stood forward and pointed fingers.,stop the bicycle.,cover up the hole.,run to catch the ball.,touch boy in red.,what does the boy in black do after swinging his leg for a while at the start?,TN
8627074061,5,4,smile and listen carefully.,try to pull it open.,talk to the people.,swing.,run and catch him.,try to pull it open.,what did the girl do after she took the green art piece from the lady?,TN
2552130183,5,8,touch the bib.,play with baby s cheek.,points to the flower.,help the baby walk.,bring book closer to baby.,help the baby walk.,what does the lady do after sitting the baby in front of her?,TN
2930782930,5,2,turn to baby and play.,pick up something.,swing her leg.,dance with hands.,walk away.,walk away.,what did the lady do after she bounced the baby at the end of the video?,TN
2495861393,5,9,leaves.,sit on grass.,look at camera.,pick up the fork.,drink the cup.,pick up the fork.,what do the children do after listening to the adult talking near the end?,TN
8318310610,5,5,tickle baby.,jump up snd down.,open her arms wide.,move hands around.,give girl more instructions.,move hands around.,what does the girl in blue jacket do after turning around at the start?,TN
3105728894,5,8,pick up disk and read.,point camera with sunglasses.,spin the rings.,try to catch the fishes.,eat.,spin the rings.,what does the man in blue clothing do after picking up the neon rings?,TN
5858985747,5,5,turn backwards.,hit toy.,cries.,jump forward.,steps on the toy.,turn backwards.,what does the baby in yellow do after raising his hands up at the start?,TN
7536230796,5,4,smile.,play with toy.,switch it on.,look into bag.,kiss baby.,switch it on.,what does the boy do after approaching the tv at the beginning?,TN
3821781616,5,0,hug boy.,raise up two more figers.,his nose.,speaking and gesture.,laughing.,speaking and gesture.,what did the man do after nodding his head in the start of the video?,TN
3375218204,5,8,read book.,cook food.,lie down.,sit down.,eat snack.,lie down.,what does the boy do after moving across the man in the middle?,TN
4485498145,5,4,turn back to her front.,play with leash.,put under amrpit.,forward.,shake baby up and down.,turn back to her front.,what does the woman in white do after looking down beside her at the start?,TN
4092992100,5,7,throw the bike away.,take off helmet.,pick up the dust.,push his bicycle up.,holds the baby.,push his bicycle up.,what does the guy in red do after the guy in yellow rode off?,TN
4949582792,5,3,wears clothes.,lift her head back up.,let go of vacuum.,pick up the seatbelt.,move her left arm.,lift her head back up.,what did the girl do after putting her head at the pram?,TN
6078524411,5,0,close his eyes.,look into camera.,chew.,puts away the residue.,hold spoon with left hand.,close his eyes.,what did the boy do after putting his head on the table?,TN
3851913128,5,5,takes off his goggles.,zoom into the baby.,caress the girl s haed.,sit down.,pick up shower head.,takes off his goggles.,what does the guy in red do after doing some hand gestures in the middle of the video?,TN
8575881495,5,1,get up.,pat dog s head.,touch with other glass.,stand up and follow boy.,makes face gesture in camera.,makes face gesture in camera.,what does the girl do after sitting up the first time?,TN
3155382178,5,4,drop bat and run.,kick the man playfully.,run towards the ball.,get up.,run after it.,run towards the ball.,what does the man do after kicking the ball away from the lady?,TN
3164519967,5,5,put on keyboard.,clap the baby s hands.,kiss baby.,shake her head.,look away.,kiss baby.,what did the old lady do after patting the baby for a while?,TN
8575881495,5,8,playing with toys.,dancing.,hand gesture.,nods her head.,looks forward.,hand gesture.,what does the girl do after getting up at the end?,TN
8313365386,5,2,touching baby s hand.,slide down.,turns the page.,wave.,move body.,turns the page.,what did the girl do after the lady in red pointed at the start?,TN
4838113006,5,5,walk off.,raise her hand.,move to her left.,drag it towards her.,clap hands.,drag it towards her.,what does the lady do after touching the first bell on table b?,TN
10109097475,5,6,happy.,walks away.,throw something.,dance.,caress the donkey.,walks away.,what does the man in red do after walking close to the plane in the middle?,TN
5875242364,5,8,swimming.,wants to go again.,sit at the side and watch him.,put his fingers in his mouth.,relaxing and playing.,put his fingers in his mouth.,what did the baby do after he touched the sides of the pool?,TN
5877508141,5,6,move his arms.,climb up the stairs.,walk towards the stair.,tries to cathc it.,fill red bowl.,move his arms.,what did the man do after the boy stopped holding on to the slide?,TN
6860322796,5,5,stand up and flip the chart.,rubs the dog.,touch baby s hand.,give attention to brown dog.,smell her legs.,give attention to brown dog.,what did the lady do after playing with the black dog for a while?,TN
5549243726,5,7,point at table.,scrunch her legs.,remote sensor.,jump.,happy.,jump.,what does the girl do after clapping her hands?,TN
2868183184,5,5,show his fist.,throw the bat and run off.,close the lid.,raised her hand.,looks up.,close the lid.,what does the man do after the girl finishes spreading the batter?,TN
5662041273,5,7,pick the ball up.,picks up the helicopter.,get back onto skateboard.,turn around.,carry the baby down.,picks up the helicopter.,what did the boy do after the helicopter fell on the floor in the middle of the video?,TN
4838145161,5,7,stood up.,licks himself.,retreat back.,staring.,licked the face.,retreat back.,what did the cat do after its nose touched the water at the beginning of the video?,TN
5498331490,5,6,cleans the toilet bowl.,throw spoon.,licked the face.,jump down.,retaliate.,cleans the toilet bowl.,what does the cat do after sitting on the toilet bowl for a while at the start?,TN
5445581571,5,6,no reaction.,white dog.,follow the black dog.,sniff dog s butt.,play with toy.,play with toy.,what did the white dog do after he looked at the black spotted dog?,TN
5445581571,5,4,follow the black dog.,try to snatch the slipper.,keeps sitting.,look at white dog.,put head outside.,look at white dog.,what did the black spotted dog do after the white dog got up from the floor?,TN
2835125654,5,5,pushed back.,carry the bear.,holds the boy in orange again.,guide the baby elephants.,laugh.,pushed back.,what does the elephant on the left do after being pushed backwards by the elephant on the right after the middle of the video?,TN
3462517143,5,3,chase the cat.,look up to the camera.,step out of container.,lying down.,walk around.,step out of container.,what does the brown dog do after circling inside the container?,TN
2793806282,5,8,look up.,fidgeting with the object.,throw it.,tried to chase.,observe it.,throw it.,what did the man on the land do with the blue toy after the lady gestured to the dog?,TN
2623954636,5,4,give to the other boy.,caress another dog.,take phone away.,put baby over shoulder.,look at the ball bounces.,look at the ball bounces.,what did the boy do after he threw the ball for the first time?,TN
4485498145,5,5,walk away.,stop and pose for camera.,talk to the person in front.,walk towards the girl with curly hair.,point below the piano.,talk to the person in front.,what does the woman in pink do after looking down at the painting at the end?,TN
3155382178,5,5,pick another ball.,raise the stick.,kicks the ball.,hit the balls.,move spoon away.,kicks the ball.,what does the lady do after she first received the ball from the man?,TN
4984417707,5,3,walk backwards.,blows the whistle.,jump down the waterfall.,swung him around.,jump on the spot.,blows the whistle.,what did the man in blue do after the elephant kicked the ball near the end?,TN
2782307049,5,3,shake head.,drink water.,dance along for fun.,picking something from ground.,help the lady in red.,help the lady in red.,what does the lady in black do after she finishes the ride?,TN
3026084730,5,11,starts playing guitar.,talks to the lady.,drink.,walks away.,lower the camera on his shirt.,walks away.,what did the three men do after the middle man finished speaking?,TN
2535384528,5,5,throw the ball.,continue playing guitar.,looks at where it goes.,hit with racket.,laughs.,looks at where it goes.,what does the man do right after hitting the ball?,TN
3375218204,5,10,dancing to rhythm.,hold boys hand.,clap his hand.,kiss baby.,lie on the boy.,hold boys hand.,what does the man do after standing up at the end?,TN
4006608424,5,7,kick it.,passes the ball.,hit the drum.,hold the swing.,prepares swinging again.,hold the swing.,what does the boy do after running towards the swing at the end?,TN
4688219212,5,7,touch his head.,take his skateboard.,pick up blanket.,shake the man s hand.,smile.,shake the man s hand.,what does the boy do after jumping down from the rings at the end?,TN
6239210933,5,7,suck his thumb.,draw.,take the toy out.,walk through her legs.,relaxing.,draw.,what does the child do after pulling up the pen and the string?,TN
2435100235,5,0,teacher and student.,strangers.,parents.,friends.,takes a photo.,friends.,what is the relationship between the man wearing the white shirt to the other cyclist he is talking to after looking to the right?,TN
5913180144,5,8,sits next to the grey lady.,smiling.,put his arm around another boy.,sits on fence.,heat up metal.,put his arm around another boy.,what does the man in blue socks do after he raises his hand and lifts his finger near the end?,TN
2871995580,5,4,pick the ball up.,walk to the box.,walk around.,turn behind to look.,play with instrument.,pick the ball up.,what did the man do after the boy threw the ball at him at the start of the video?,TN
4147398280,5,7,walks towards the camera.,shakes the box.,hit the ball.,dancing and jumping.,twist it again.,twist it again.,what does the boy do after managing to solve one face of the rubik?,TN
9498159305,5,7,walk towards the boy.,help the man.,walk towards the aircraft.,use towel cover it.,touch the earphones.,touch the earphones.,what did the man do after the penguin turned away?,TN
3145698830,5,1,talked to the toddler.,put baby on chest.,let the baby sit.,hi-five.,smile.,let the baby sit.,what did the man do after pulling the baby to him?,TN
